"catch-difficulty","catch-phrase","color-1","color-2","creature-type","critterpedia-filename","critterpedia-image","description","furniture-filename","furniture-image","hha-base-points","hha-category","icon-filename","icon-image","id","lighting-type","movement-speed","name","nh-apr","nh-aug","nh-dec","nh-feb","nh-jan","nh-jul","nh-jun","nh-mar","nh-may","nh-nov","nh-oct","nh-sep","sell","sh-apr","sh-aug","sh-dec","sh-feb","sh-jan","sh-jul","sh-jun","sh-mar","sh-may","sh-nov","sh-oct","sh-sep","shadow","size","spawn-rates","surface","total-catches-to-unlock","vision","weather","where-how"
"Hard","I caught a bitterling! It's mad at me, but only a little.","Light blue","Blue","Fish","FishTanago","https://acnhcdn.com/latest/BookFishIcon/FishTanagoCropped.png","Bitterlings hide their eggs inside large bivalves—like clams—where the young can stay safe until grown. The bitterling isn't being sneaky. No, their young help keep the bivalve healthy by eating invading parasites! It's a wonderful bit of evolutionary deal making, don't you think? Each one keeping the other safe... Though eating parasites does not sound like a happy childhood... Is that why the fish is so bitter?","FtrFishTanago","https://acnhcdn.com/latest/FtrIcon/FtrFishTanago.png",71,"Pet","Fish0","https://acnhcdn.com/latest/MenuIcon/Fish0.png","F1","No lighting",NA,"bitterling",NA,NA,"All day","All day","All day",NA,NA,"All day",NA,"All day",NA,NA,900,NA,"All day",NA,NA,NA,"All day","All day",NA,"All day",NA,NA,"All day","X-Small","1x1","12–17","No",0,"Medium","Any weather","River"
"Medium","I caught a killifish! The streams are safe again.","Yellow","Black","Fish","FishMedaka","https://acnhcdn.com/latest/BookFishIcon/FishMedakaCropped.png","Ah, the magnificent killifish! Did you know there are over 1,000 different species? My own favorite killifish species are the mangrove, which can live on land for weeks, breathing air! And the mummichog, the first fish ever brought to space. I wonder if the killifish you've brought me is related to either those intrepid explorers?","FtrFishMedaka","https://acnhcdn.com/latest/FtrIcon/FtrFishMedaka.png",71,"Pet","Fish9","https://acnhcdn.com/latest/MenuIcon/Fish9.png","F10","Fluorescent",NA,"killifish","All day","All day",NA,NA,NA,"All day","All day",NA,"All day",NA,NA,NA,300,NA,NA,"All day","All day","All day",NA,NA,NA,NA,"All day","All day",NA,"X-Small","1x1","3–4","No",0,"Medium","Any weather","Pond"
"Very Easy","I caught a crawfish! Or else it's a lobster and I'm a giant!","Red","Black","Fish","FishZarigani","https://acnhcdn.com/latest/BookFishIcon/FishZariganiCropped.png","Ohoo! So you have found a crawfish. Neither crab nor lobster, crawfish evolved in an interesting manner. Beware their fearsome pinchy pinchers! Behold their many legs! I say! It is a big bug-like, eh wot...The more I look at it, the more unsettled I feel... Let's be done with this and never speak of it again, shall we?","FtrFishZarigani","https://acnhcdn.com/latest/FtrIcon/FtrFishZarigani.png",71,"Pet","Fish10","https://acnhcdn.com/latest/MenuIcon/Fish10.png","F11","Fluorescent",NA,"crawfish","All day","All day",NA,NA,NA,"All day","All day",NA,"All day",NA,NA,"All day",200,NA,NA,"All day","All day","All day",NA,NA,"All day",NA,"All day","All day",NA,"Small","1x1","4–12","No",0,"Very Wide","Any weather","Pond"
"Hard","I caught a soft-shelled turtle! It's more sensitive than other turtles.; I caught a soft-shelled turtle! I should take a shellfie!","Green","Black","Fish","FishSuppon","https://acnhcdn.com/latest/BookFishIcon/FishSupponCropped.png","These relatives of common turtles will not let go when they decide to bite down on something. Although they can be quite shy, they will become a bit aggressive when threatened. They are often found in water and are very good swimmers because of the flat shape of their shells. They swim with their snouts over the surface of the water so they can breathe. Soft-shelled turtles aren't safe to hold because they are so prone to biting at the slightest movement. However, if one bites down on you, it will usually let go when you put it safely back in the water.","FtrFishSuppon","https://acnhcdn.com/latest/FtrIcon/FtrFishSuppon.png",71,"Pet","Fish65","https://acnhcdn.com/latest/MenuIcon/Fish65.png","F12","No lighting",NA,"soft-shelled turtle",NA,"4 PM – 9 AM",NA,NA,NA,NA,NA,NA,NA,NA,NA,"4 PM – 9 AM",3750,NA,NA,NA,"4 PM – 9 AM",NA,NA,NA,"4 PM – 9 AM",NA,NA,NA,NA,"Large","1x1","4","No",20,"Narrow","Any weather","River"
"Hard","I caught a snapping turtle! How can it snap without fingers?","Brown","Black","Fish","FishKamitsukigame","https://acnhcdn.com/latest/BookFishIcon/FishKamitsukigameCropped.png","The snapping turtle is a large turtle known for it's crocodile-like body and long claws. No, wait-- it is better known for it's ferocious bite, which it can deliver with shocking speed for a turtle. NO, WAIT-- it is BEST known for that time one chased me across a parking lot and I had to climb on top of a car.","FtrFishKamitukigame","https://acnhcdn.com/latest/FtrIcon/FtrFishKamitukigame.png",71,"Pet","Fish78","https://acnhcdn.com/latest/MenuIcon/Fish78.png","F13","No lighting",NA,"snapping turtle","9 PM – 4 AM","9 PM – 4 AM",NA,NA,NA,"9 PM – 4 AM","9 PM – 4 AM",NA,"9 PM – 4 AM",NA,"9 PM – 4 AM","9 PM – 4 AM",5000,"9 PM – 4 AM",NA,"9 PM – 4 AM","9 PM – 4 AM","9 PM – 4 AM",NA,NA,"9 PM – 4 AM",NA,"9 PM – 4 AM","9 PM – 4 AM",NA,"Large","1x1","2–3","No",0,"Medium","Any weather","River"
"Easy","I caught a tadpole... It's just a tad small.","Black","Blue","Fish","FishOtamajakusi","https://acnhcdn.com/latest/BookFishIcon/FishOtamajakusiCropped.png","Undoubtedly you know that tadpoles eventually turn into frogs. I must say, I find them impossibly adorable with their squiggly little tails. But even cuter... when they sprout legs! Why, we can witness accelerated evolution in these squirmy little ones. Hoo, it makes me so emotional!","FtrFishOtama","https://acnhcdn.com/latest/FtrIcon/FtrFishOtama.png",71,"Pet","Fish64","https://acnhcdn.com/latest/MenuIcon/Fish64.png","F14","No lighting",NA,"tadpole","All day",NA,NA,NA,NA,"All day","All day","All day","All day",NA,NA,NA,100,NA,NA,"All day",NA,"All day",NA,NA,NA,NA,"All day","All day","All day","X-Small","1x1","5–6","No",0,"Very Wide","Any weather","Pond"
"Easy","I caught a frog! Or it's a new neighbor...and I have some apologizing to do.","Green","Black","Fish","FishKaeru","https://acnhcdn.com/latest/BookFishIcon/FishKaeruCropped.png","I understand that frogs converse with fellow frogs through a number of varied calls, as it were. Ribbit! My prince has arrived! Gribbit riiibbit! This pond is tragic! Ribbity rib't! I think you're splendid! Hoo hoo, of course I have no clue what they're saying, but I like to think if I practice enough, I might!","FtrFishKaeru","https://acnhcdn.com/latest/FtrIcon/FtrFishKaeru.png",71,"Pet","Fish11","https://acnhcdn.com/latest/MenuIcon/Fish11.png","F15","Fluorescent",NA,"frog",NA,"All day",NA,NA,NA,"All day","All day",NA,"All day",NA,NA,NA,120,NA,NA,"All day","All day","All day",NA,NA,NA,NA,"All day",NA,NA,"Small","1x1","7–9","No",0,"Very Wide","Any weather","Pond"
"Very Easy","I caught a freshwater goby! Time to go bye-bye!","Brown","Black","Fish","FishDonko","https://acnhcdn.com/latest/BookFishIcon/FishDonkoCropped.png","The freshwater goby is an unassuming specimen. But beneath that calm, fish exterior, true gluttony resides! It will eat anything that will fit in its mouth...And its mouth is quite the gaping maw, so I recommend you refrain from drawing attention to yourself!","FtrFishDonko","https://acnhcdn.com/latest/FtrIcon/FtrFishDonko.png",71,"Pet","Fish12","https://acnhcdn.com/latest/MenuIcon/Fish12.png","F16","Fluorescent",NA,"freshwater goby","4 PM – 9 AM","4 PM – 9 AM","4 PM – 9 AM","4 PM – 9 AM","4 PM – 9 AM","4 PM – 9 AM","4 PM – 9 AM","4 PM – 9 AM","4 PM – 9 AM","4 PM – 9 AM","4 PM – 9 AM","4 PM – 9 AM",400,"4 PM – 9 AM","4 PM – 9 AM","4 PM – 9 AM","4 PM – 9 AM","4 PM – 9 AM","4 PM – 9 AM","4 PM – 9 AM","4 PM – 9 AM","4 PM – 9 AM","4 PM – 9 AM","4 PM – 9 AM","4 PM – 9 AM","Small","1x1","2–5","Yes",0,"Medium","Any weather","River"
"Easy","I caught a loach! It's...looking at me with reproach.","Brown","Blue","Fish","FishDojou","https://acnhcdn.com/latest/BookFishIcon/FishDojouCropped.png","Loaches are a large group of bottom-feeding freshwater fish. Because there are so many species, it is difficult to generalize about them all. The one thing they all have in common is perhaps their most unappealing trait; the name 'loach.' Repellent, isn't it? They should have just called it the 'cockloach' and been done with it, eh wot! Loach...loach... It just tastes terrible in the beak.","FtrFishDojou","https://acnhcdn.com/latest/FtrIcon/FtrFishDojou.png",71,"Pet","Fish13","https://acnhcdn.com/latest/MenuIcon/Fish13.png","F17","No lighting",NA,"loach","All day",NA,NA,NA,NA,NA,NA,"All day","All day",NA,NA,NA,400,NA,NA,NA,NA,NA,NA,NA,NA,NA,"All day","All day","All day","Small","1x1","12–16","No",0,"Wide","Any weather","River"
"Medium","I caught a catfish! I'm more of a dogfish person...","Black","Black","Fish","FishNamazu","https://acnhcdn.com/latest/BookFishIcon/FishNamazuCropped.png","Catfish don't have scales and are rather slimy. Believe it or not, this slime helps them breathe! Some species of catfish are nocturnal, and they'll feed on almost anything. They use a suctioning action to pull in their food. Did I mention they can grow as large as you or I?","FtrFishNamazu","https://acnhcdn.com/latest/FtrIcon/FtrFishNamazu.png",71,"Pet","Fish14","https://acnhcdn.com/latest/MenuIcon/Fish14.png","F18","Fluorescent",NA,"catfish",NA,"4 PM – 9 AM",NA,NA,NA,"4 PM – 9 AM","4 PM – 9 AM",NA,"4 PM – 9 AM",NA,"4 PM – 9 AM","4 PM – 9 AM",800,"4 PM – 9 AM",NA,"4 PM – 9 AM","4 PM – 9 AM","4 PM – 9 AM",NA,NA,"4 PM – 9 AM",NA,"4 PM – 9 AM",NA,NA,"Large","1x1","6–8","Yes",0,"Medium","Any weather","Pond"
"Hard","I caught a giant snakehead! Um...but I asked for a medium?","Black","Black","Fish","FishRaigyo","https://acnhcdn.com/latest/BookFishIcon/FishRaigyoCropped.png","The giant snakehead is quite a sight to behold, wot! One glance conjurs up visions of its namesake. This resilient creature can even find a home in the mud, where it is able to breathe. As a matter of fact, it dislikes cold weather, so during wintertime the mud serves as its temporary home. I hear that they eat anything that swims past their head. While odd, I feel a sense of owlship with them.","FtrFishRaigyo","https://acnhcdn.com/latest/FtrIcon/FtrFishRaigyo.png",71,"Pet","Fish16","https://acnhcdn.com/latest/MenuIcon/Fish16.png","F19","Fluorescent",NA,"giant snakehead",NA,"9 AM – 4 PM",NA,NA,NA,"9 AM – 4 PM","9 AM – 4 PM",NA,NA,NA,NA,NA,5500,NA,NA,"9 AM – 4 PM","9 AM – 4 PM","9 AM – 4 PM",NA,NA,NA,NA,NA,NA,NA,"Large","2x1","2","Yes",50,"Medium","Any weather","Pond"
"Easy","I caught a pale chub! That name seems a bit judgy...","Blue","Blue","Fish","FishOikawa","https://acnhcdn.com/latest/BookFishIcon/FishOikawaCropped.png","The pale chub is a river fish with simple back-and-silver coloring. Interestingly, the males' coloring becomes most vibrant when he's trying to attract a mate! Though normally plain, these fellows really know how to look stylish when they want to. Perhaps I could learn a thing or two from the pale chub...","FtrFishOikawa","https://acnhcdn.com/latest/FtrIcon/FtrFishOikawa.png",71,"Pet","Fish1","https://acnhcdn.com/latest/MenuIcon/Fish1.png","F2","No lighting",NA,"pale chub","9 AM – 4 PM","9 AM – 4 PM","9 AM – 4 PM","9 AM – 4 PM","9 AM – 4 PM","9 AM – 4 PM","9 AM – 4 PM","9 AM – 4 PM","9 AM – 4 PM","9 AM – 4 PM","9 AM – 4 PM","9 AM – 4 PM",200,"9 AM – 4 PM","9 AM – 4 PM","9 AM – 4 PM","9 AM – 4 PM","9 AM – 4 PM","9 AM – 4 PM","9 AM – 4 PM","9 AM – 4 PM","9 AM – 4 PM","9 AM – 4 PM","9 AM – 4 PM","9 AM – 4 PM","X-Small","1x1","6–9","No",0,"Wide","Any weather","River"
"Very Easy","I caught a bluegill! Do you think it calls me ""pinklung""?","Blue","Black","Fish","FishBlueguill","https://acnhcdn.com/latest/BookFishIcon/FishBlueguillCropped.png","The bluegill is incredibly common. A bit too common, depending upon where you are. They eat anything that fits in their mouths and are highly adaptable. The bane of fishermen in some areas, bluegill is often the only fish to be caught! But looking in its wee beady eyes, I must say I see no ill will in it...","FtrFishBlueguill","https://acnhcdn.com/latest/FtrIcon/FtrFishBlueguill.png",71,"Pet","Fish17","https://acnhcdn.com/latest/MenuIcon/Fish17.png","F20","No lighting",NA,"bluegill","9 AM – 4 PM","9 AM – 4 PM","9 AM – 4 PM","9 AM – 4 PM","9 AM – 4 PM","9 AM – 4 PM","9 AM – 4 PM","9 AM – 4 PM","9 AM – 4 PM","9 AM – 4 PM","9 AM – 4 PM","9 AM – 4 PM",180,"9 AM – 4 PM","9 AM – 4 PM","9 AM – 4 PM","9 AM – 4 PM","9 AM – 4 PM","9 AM – 4 PM","9 AM – 4 PM","9 AM – 4 PM","9 AM – 4 PM","9 AM – 4 PM","9 AM – 4 PM","9 AM – 4 PM","Small","1x1","6–10","No",0,"Very Wide","Any weather","River"
"Medium","I caught a yellow perch! Those yellow birds have to sit somewhere!","Yellow","Black","Fish","FishYellowparch","https://acnhcdn.com/latest/BookFishIcon/FishYellowparchCropped.png","The yellow perch is certainly worth squawking about. I find it a sight to behold! That jagged dorsal fin! Those brilliant stripes! Those glorious colours! Hoo, truly it is quite the specimen. I would be thrilled to witness it firsthand in its natural environment... But the yellow perch's peak season is winter, I'm afraid. (So very afraid... of winter's biting chill...)","FtrFishYellowparch","https://acnhcdn.com/latest/FtrIcon/FtrFishYellowparch.png",71,"Pet","Fish18","https://acnhcdn.com/latest/MenuIcon/Fish18.png","F21","Fluorescent",NA,"yellow perch",NA,NA,"All day","All day","All day",NA,NA,"All day",NA,"All day","All day",NA,300,"All day","All day",NA,NA,NA,"All day","All day",NA,"All day",NA,NA,"All day","Medium","1x1","7–10","Yes",0,"Narrow","Any weather","River"
"Medium","I caught a black bass! The most metal of all fish!","Green","Black","Fish","FishBlackbass","https://acnhcdn.com/latest/BookFishIcon/FishBlackbassCropped.png","The black bass is a formidably strong fish and, as such, is a common target for sport anglers. In some areas, there are even those who professionally catch just black bass! Yet in other areas where they are NOT native, they are considered an ecological nuisance. Invasive, even. One cannot help but wonder who is to blame for their invasion, hoo.","FtrFishBlackbass","https://acnhcdn.com/latest/FtrIcon/FtrFishBlackbass.png",71,"Pet","Fish19","https://acnhcdn.com/latest/MenuIcon/Fish19.png","F22","Fluorescent",NA,"black bass","All day","All day","All day","All day","All day","All day","All day","All day","All day","All day","All day","All day",400,"All day","All day","All day","All day","All day","All day","All day","All day","All day","All day","All day","All day","Large","1x1","4–12","Yes",0,"Medium","Any weather","River"
"Hard","I caught a tilapia! It makes me happy-a!","Black","Black","Fish","FishThirapia","https://acnhcdn.com/latest/BookFishIcon/FishThirapiaCropped.png","Wherever the waters are warm, the tilapia can be found. It is a highly adaptable river fish. They mainly feed on algae, but they will also eat larvae and dead fish— or whatever fits in their mouths. I will confess that, as a growing owlet, I similarly defined food as 'anything that fits in my beak.'","FtrFishThirapia","https://acnhcdn.com/latest/FtrIcon/FtrFishThirapia.png",71,"Pet","Fish76","https://acnhcdn.com/latest/MenuIcon/Fish76.png","F23","Fluorescent",NA,"tilapia",NA,"All day",NA,NA,NA,"All day","All day",NA,NA,NA,"All day","All day",800,"All day",NA,"All day","All day","All day",NA,NA,"All day",NA,NA,NA,NA,"Medium","1x1","7–9","Yes",0,"Medium","Any weather","River"
"Medium","I caught a pike! Think a swordfish would be up for a duel?","Green","Black","Fish","FishPaiku","https://acnhcdn.com/latest/BookFishIcon/FishPaikuCropped.png","The pike has always reminded me a bit of salmon, although a pike can grow rather larger. These brutes can grow to over four feet long, sometimes MUCH over! Hoo hoo! It is carnivorous and preys not only on other fish, but also mammals and some waterfowl. If I were to ever meet one in the water, I would have a most difficult time keeping my wits about me.","FtrFishPaiku","https://acnhcdn.com/latest/FtrIcon/FtrFishPaiku.png",71,"Pet","Fish20","https://acnhcdn.com/latest/MenuIcon/Fish20.png","F24","Fluorescent",NA,"pike",NA,NA,"All day",NA,NA,NA,NA,NA,NA,"All day","All day","All day",1800,"All day",NA,NA,NA,NA,NA,"All day","All day","All day",NA,NA,NA,"X-Large","2x1","1–2","Yes",20,"Medium","Any weather","River"
"Easy","I caught a pond smelt! Whoever smelt it dealt it!","Orange","Blue","Fish","FishWakasagi","https://acnhcdn.com/latest/BookFishIcon/FishWakasagiCropped.png","For many, thinking of pond smelt inevitably leads to thoughts of ice fishing in frozen rivers and lakes. Ice fishing involves making a round hole in the ice, dropping in your fishing line, and...waiting. Not to rain on anyone else's idea of fun, but...well, perhaps I shouldn't say anything.","FtrFishWakasagi","https://acnhcdn.com/latest/FtrIcon/FtrFishWakasagi.png",71,"Pet","Fish21","https://acnhcdn.com/latest/MenuIcon/Fish21.png","F25","No lighting",NA,"pond smelt",NA,NA,"All day","All day","All day",NA,NA,NA,NA,NA,NA,NA,400,NA,"All day",NA,NA,NA,"All day","All day",NA,NA,NA,NA,NA,"Small","1x1","18–20","No",0,"Wide","Any weather","River"
"Hard","I caught a sweetfish! Hope it's not artificially sweet!","Green","Black","Fish","FishAyu","https://acnhcdn.com/latest/BookFishIcon/FishAyuCropped.png","Sweetfish are the damp heralds of summer! These slippery fellows appear in numbers when it warms up. They hatch in a river, then swim to the ocean. Once mature, they return to the river where they were born. But when they return depends on the river temperature— if it's too cold their fishing season will start later. Some even say summer can't start without sweetfish despite the KEY role played by the earth's axial tilt!","FtrFishAyu","https://acnhcdn.com/latest/FtrIcon/FtrFishAyu.png",71,"Pet","Fish22","https://acnhcdn.com/latest/MenuIcon/Fish22.png","F26","Fluorescent",NA,"sweetfish",NA,"All day",NA,NA,NA,"All day",NA,NA,NA,NA,NA,"All day",900,NA,NA,NA,"All day","All day",NA,NA,"All day",NA,NA,NA,NA,"Medium","1x1","5–10","Yes",0,"Medium","Any weather","River"
"Medium","I caught a cherry salmon! It's the perfect topper for a marlin sundae!","Brown","Black","Fish","FishYamame","https://acnhcdn.com/latest/BookFishIcon/FishYamameCropped.png","The cherry salmon is related to the salmon, and is known for its distinctive pattern of ""polka dots"". There polka dots disappear as they mature, but ONLY in the first of certain geographic regions. Pity the poor researchers that must make sense of the cherry salmon's fickle fashion sense.","FtrFishYamame","https://acnhcdn.com/latest/FtrIcon/FtrFishYamame.png",71,"Pet","Fish23","https://acnhcdn.com/latest/MenuIcon/Fish23.png","F27","Fluorescent",NA,"cherry salmon","4 PM – 9 AM",NA,NA,NA,NA,NA,"4 PM – 9 AM","4 PM – 9 AM","4 PM – 9 AM","All day","All day","All day",1000,"All day",NA,"4 PM – 9 AM",NA,NA,NA,NA,"All day","All day","4 PM – 9 AM","4 PM – 9 AM","4 PM – 9 AM","Medium","1x1","3–9","Yes",0,"Narrow","Any weather","River (clifftop)"
"Hard","I caught a char! Now I'm gonna sit on it!","Brown","Black","Fish","FishOoiwana","https://acnhcdn.com/latest/BookFishIcon/FishOoiwanaCropped.png","The char is one of the bigger first around the world, and, in the world of fish, that's quite an accomplishment! They are territorial predators, and therefore must constantly defend their 'turf' from others. So when you see a large char like this one, it is likely a skilled fighter and veteran of many battles. My feathers! I hope it never has cause to go into battle with me!","FtrFishOoiwana","https://acnhcdn.com/latest/FtrIcon/FtrFishOoiwana.png",71,"Pet","Fish24","https://acnhcdn.com/latest/MenuIcon/Fish24.png","F28","Fluorescent",NA,"char","4 PM – 9 AM",NA,NA,NA,NA,NA,"4 PM – 9 AM","4 PM – 9 AM","4 PM – 9 AM","All day","All day","All day",3800,"All day",NA,"4 PM – 9 AM",NA,NA,NA,NA,"All day","All day","4 PM – 9 AM","4 PM – 9 AM","4 PM – 9 AM","Medium","1x1","1–4","Yes",20,"Narrow","Any weather","River (clifftop)"
"Very Hard","I caught a golden trout! But the real treasure? Friendship.","Brown","Black","Fish","FishGoldenTorauto","https://acnhcdn.com/latest/BookFishIcon/FishGoldenTorautoCropped.png","The golden trout is a beautifully colored fish that can only live in very clean waters. They are difficult to come across since they are found only in high mountain streams. As a side note, I find it much easier to appreciate fish that aren't such prima donnas about everything.","FtrFishGoldenTorauto","https://acnhcdn.com/latest/FtrIcon/FtrFishGoldenTorauto.png",71,"Pet","Fish79","https://acnhcdn.com/latest/MenuIcon/Fish79.png","F29","Fluorescent",NA,"golden trout","4 PM – 9 AM",NA,NA,NA,NA,NA,NA,"4 PM – 9 AM","4 PM – 9 AM","4 PM – 9 AM","4 PM – 9 AM","4 PM – 9 AM",15000,"4 PM – 9 AM",NA,NA,NA,NA,NA,NA,"4 PM – 9 AM","4 PM – 9 AM","4 PM – 9 AM","4 PM – 9 AM","4 PM – 9 AM","Medium","1x1","1","Yes",100,"Very Narrow","Any weather","River (clifftop)"
"Very Easy","I caught a crucian carp! My skills are sharp!","Brown","Black","Fish","FishFuna","https://acnhcdn.com/latest/BookFishIcon/FishFunaCropped.png","I wonder... Do you know how to tell the difference between a crucian carp and a standard-issue carp? It's quite easy to tell the two apart... One must simply locate the barbels. Or, rather, the lack of them! And just what is a barbel, you ask? Well, a barbel looks a little something like a mustache. A run-of-the-mill carp will sport this unsightly ""facial hair,"" while a crucian carp is considerably better groomed! I tried to grow a mustache when I was younger. It never did fill in quite right... All for the best in the end, as mustaches go so much better with noses than with beaks!","FtrFishFuna","https://acnhcdn.com/latest/FtrIcon/FtrFishFuna.png",71,"Pet","Fish2","https://acnhcdn.com/latest/MenuIcon/Fish2.png","F3","Fluorescent",NA,"crucian carp","All day","All day","All day","All day","All day","All day","All day","All day","All day","All day","All day","All day",160,"All day","All day","All day","All day","All day","All day","All day","All day","All day","All day","All day","All day","Small","1x1","4–12","Yes",0,"Wide","Any weather","River"
"Very Hard","OH MY GOSH! I caught a stringfish! Five more and I'll have a guitarfish!","Brown","Black","Fish","FishItou","https://acnhcdn.com/latest/BookFishIcon/FishItouCropped.png","The stringfish grows slowly, but also lives quite a long time for a fish, with up to 15 years being typical. Consequently, while it takes a while, they can get quite large-perhaps even up to six feet long! The stringfish is perhaps the best embodiment in the fish world of 'slow and steady wins the race'","FtrFishItou","https://acnhcdn.com/latest/FtrIcon/FtrFishItou.png",71,"Pet","Fish26","https://acnhcdn.com/latest/MenuIcon/Fish26.png","F30","Fluorescent",NA,"stringfish",NA,NA,"4 PM – 9 AM","4 PM – 9 AM","4 PM – 9 AM",NA,NA,"4 PM – 9 AM",NA,NA,NA,NA,15000,NA,"4 PM – 9 AM",NA,NA,NA,"4 PM – 9 AM","4 PM – 9 AM",NA,NA,NA,NA,"4 PM – 9 AM","X-Large","2x1","1","Yes",100,"Very Narrow","Any weather","River (clifftop)"
"Medium","I caught a salmon! It's all upstream from here!","Brown","Black","Fish","FishSake","https://acnhcdn.com/latest/BookFishIcon/FishSakeCropped.png","Ah, salmon! Did you know their coloration is due specifically to their diet? Indeed, this is the case! The more they fill their diet with crustaceans such as krill and shrimp, the deeper shade of pink they are. If they ate a bushel of carrots, might they turn orange?","FtrFishSake","https://acnhcdn.com/latest/FtrIcon/FtrFishSake.png",71,"Pet","Fish27","https://acnhcdn.com/latest/MenuIcon/Fish27.png","F31","Fluorescent",NA,"salmon",NA,NA,NA,NA,NA,NA,NA,NA,NA,NA,NA,"All day",700,NA,NA,NA,NA,NA,NA,NA,"All day",NA,NA,NA,NA,"Large","2x1","20","Yes",0,"Medium","Any weather","River (mouth)"
"Hard","WOO-HOO! I caught a King salmon! Checkmate!","Gray","Black","Fish","FishKingsalmon","https://acnhcdn.com/latest/BookFishIcon/FishKingsalmonCropped.png","The king salmon didn't get its name for nothing.This stately fish can weigh in at up to 130 pounds! It's clear why it's referred to as the king of salmon. I imagine even the mightiest net can catch no more than a few at a time.I must say it's a miracle to me that you didn't get dragged out to sea by this one, wot!","FtrFishKingsalmon","https://acnhcdn.com/latest/FtrIcon/FtrFishKingsalmon.png",71,"Pet","Fish28","https://acnhcdn.com/latest/MenuIcon/Fish28.png","F32","Fluorescent",NA,"king salmon",NA,NA,NA,NA,NA,NA,NA,NA,NA,NA,NA,"All day",1800,NA,NA,NA,NA,NA,NA,NA,"All day",NA,NA,NA,NA,"X-Large","2x1","5","Yes",20,"Medium","Any weather","River (mouth)"
