"catch-difficulty","catch-phrase","color-1","color-2","creature-type","critterpedia-filename","critterpedia-image","description","furniture-filename","furniture-image","hha-base-points","hha-category","icon-filename","icon-image","id","lighting-type","movement-speed","name","nh-apr","nh-aug","nh-dec","nh-feb","nh-jan","nh-jul","nh-jun","nh-mar","nh-may","nh-nov","nh-oct","nh-sep","sell","sh-apr","sh-aug","sh-dec","sh-feb","sh-jan","sh-jul","sh-jun","sh-mar","sh-may","sh-nov","sh-oct","sh-sep","shadow","size","spawn-rates","surface","total-catches-to-unlock","vision","weather","where-how"
NA,"I caught a tiger beetle! I pounced first!","Green","Yellow","Insect","InsectHanmyou","https://acnhcdn.com/latest/BookInsectIcon/InsectHanmyouCropped.png","The tiger beetle is extremely fleet of foot, though it runs in a rather peculiar way. That is, it sprints, then stops, then sprints again...using these speedy maneuvers to run down its prey. You see, the tiger beetle—like a real tiger—is a powerful predator. The mere thought of it giving chase gives me the willies. Tigers are terrifying at any size.","FtrInsectHanmyou","https://acnhcdn.com/latest/FtrIcon/FtrInsectHanmyouCropped.png",64,"Pet","Ins70","https://acnhcdn.com/latest/MenuIcon/Ins70.png","I44",NA,NA,"tiger beetle","All day","All day",NA,"All day",NA,"All day","All day","All day","All day",NA,"All day","All day",1500,"All day","All day","All day","All day","All day",NA,NA,"All day",NA,"All day","All day","All day",NA,"1x1","15","No",20,NA,"Any except rain","On the ground"
NA,"I caught a tiger butterfly! I've earned my stripes!","Yellow","Green","Insect","InsectAgehacho","https://acnhcdn.com/latest/BookInsectIcon/InsectAgehachoCropped.png","Tiger butterflies are known for their majestic wings, which many consider quite beautiful. Truth be told, I find them monstrous! Those strange striped patterns... They give this owl the goose bumps! And while you may imagine young tiger butterfly larvae to look like lovely green caterpillars...it's not so! Why, when tiger butterflies are but babes, they're covered in unsightly white, brown, and black spots. In this way, they camouflage themselves as...as...bird droppings! Putrid pests, indeed!","FtrInsectAgehacho","https://acnhcdn.com/latest/FtrIcon/FtrInsectAgehachoCropped.png",64,"Pet","Ins2","https://acnhcdn.com/latest/MenuIcon/Ins2.png","I3",NA,NA,"tiger butterfly","4 AM – 7 PM","4 AM – 7 PM",NA,NA,NA,"4 AM – 7 PM","4 AM – 7 PM","4 AM – 7 PM","4 AM – 7 PM",NA,NA,"4 AM – 7 PM",240,NA,NA,"4 AM – 7 PM","4 AM – 7 PM","4 AM – 7 PM",NA,NA,"4 AM – 7 PM",NA,"4 AM – 7 PM","4 AM – 7 PM","4 AM – 7 PM",NA,"1x1","40","Yes",0,NA,"Any except rain","Flying"
NA,"I caught a violin beetle! Apparently I'm as fit as a fiddle!","Brown","Black","Insect","InsectBaiorinmushi","https://acnhcdn.com/latest/BookInsectIcon/InsectBaiorinmushiCropped.png","The violin beetle gets its name from its shape. That is, SOME think it resembles the stringed instrument. If you ask me, this is an insult to violins! With its flat body and small head, the violin beetle looks like nothing but a repulsive bug, plain and simple. In fact it is so repulsive, it oozes a foul liquid when frightened! Ugh! This insect strikes a sour note indeed.","FtrInsectBaiorinmushi","https://acnhcdn.com/latest/FtrIcon/FtrInsectBaiorinmushiCropped.png",64,"Pet","Ins38","https://acnhcdn.com/latest/MenuIcon/Ins38.png","I46",NA,NA,"violin beetle",NA,NA,NA,NA,NA,NA,"All day",NA,"All day","All day","All day","All day",450,"All day",NA,"All day",NA,NA,NA,NA,"All day","All day","All day",NA,NA,NA,"1x1","10","Yes",0,NA,"Any except rain","On tree stumps"
NA,"I caught a walker cicada! Pffft... I walk all the time and no one calls me ""Walker ...""; I caught a walker cicada! It must hate getting its feet wet.","Black","Pink","Insect","InsectTsukutsukuhousi","https://acnhcdn.com/latest/BookInsectIcon/InsectTsukutsukuhousiCropped.png","The walker cicada is quite the noisy thing. I tell you, this impolite pest simply canNOT abide the quiet. In the heat of summer, the male strikes up a strange rattling song, hoping to woo a mate. When other male cicadas hear this rhythmic racket, they join right in... As if it were a sing-along! My head aches at the thought of it.","FtrInsectTsukutsukuhousi","https://acnhcdn.com/latest/FtrIcon/FtrInsectTsukutsukuhousiCropped.png",64,"Pet","Ins19","https://acnhcdn.com/latest/MenuIcon/Ins19.png","I29",NA,NA,"walker cicada",NA,"8 AM – 5 PM",NA,NA,NA,NA,NA,NA,NA,NA,NA,"8 AM – 5 PM",400,NA,NA,NA,"8 AM – 5 PM",NA,NA,NA,"8 AM – 5 PM",NA,NA,NA,NA,NA,"1x1","40","Yes",0,NA,"Any weather","On hardwood/cedar trees"
NA,"I caught a walking leaf! It seems to be taking it in stride!","Green","Green","Insect","InsectKonohamushi","https://acnhcdn.com/latest/BookInsectIcon/InsectKonohamushiCropped.png","What a fraud! What a phony! The walking leaf is, in fact, the very embodiment of a lie! This master mimic looks like a tree leaf all the way down to the tiniest details. In fact, this bug has been known to sway to and fro as it walks...just so it looks like a leaf blown by the wind! And the fakery works! These insects look so much like leaves that even leaf-eating insects nibble on them! Lying liars, indeed!","FtrInsectKonohamushi","https://acnhcdn.com/latest/FtrIcon/FtrInsectKonohamushiCropped.png",64,"Pet","Ins34","https://acnhcdn.com/latest/MenuIcon/Ins34.png","I67",NA,NA,"walking leaf",NA,"All day",NA,NA,NA,"All day",NA,NA,NA,NA,NA,"All day",600,NA,NA,NA,"All day","All day",NA,NA,"All day",NA,NA,NA,NA,NA,"1x1","10","Yes",20,NA,"Any weather","Disguised under trees"
NA,"I caught a walking stick! Check out its walking schtick! Look, these are the jokes, OK?","Brown","Yellow","Insect","InsectNanafushi","https://acnhcdn.com/latest/BookInsectIcon/InsectNanafushiCropped.png","The walking stick looks just like a twig, does it not? Hoo! It even has knots like a real twig would! These bashful bugs mimic plants in this way to hide from predators. A noble goal, you might say. But though the deceptive wretches fool some, they do not fool me! I see these bugs for what they are... Monsters, plain and simple! I say, did you know that walking sticks can grow to two feet long?! Imagine running into one! Surely I would faint.","FtrInsectNanafushi","https://acnhcdn.com/latest/FtrIcon/FtrInsectNanafushiCropped.png",64,"Pet","Ins35","https://acnhcdn.com/latest/MenuIcon/Ins35.png","I66",NA,NA,"walking stick",NA,"4 AM – 8 AM; 5 PM – 7 PM",NA,NA,NA,"4 AM – 8 AM; 5 PM – 7 PM",NA,NA,NA,"4 AM – 8 AM; 5 PM – 7 PM","4 AM – 8 AM; 5 PM – 7 PM","4 AM – 8 AM; 5 PM – 7 PM",600,"4 AM – 8 AM; 5 PM – 7 PM",NA,NA,"4 AM – 8 AM; 5 PM – 7 PM","4 AM – 8 AM; 5 PM – 7 PM",NA,NA,"4 AM – 8 AM; 5 PM – 7 PM","4 AM – 8 AM; 5 PM – 7 PM",NA,NA,NA,NA,"1x1","10","Yes",20,NA,"Any weather","On trees (any kind)"
NA,"I caught a wasp! That's gotta sting...","Yellow","Orange","Insect","InsectHachi","https://acnhcdn.com/latest/BookInsectIcon/InsectHachiCropped.png","Hoo! Allow me to share a fact with you! Wasps are sometimes called ""meat bees"" because... They. Eat. MEAT! MEAT! Of almost any sort! Surely you've seen what a menace they make of themselves at picnics. 'Tis hardly the worst of it, wot wot! Aggressive predators with venomous stingers, wasps not only hunt and eat other insects... they paralyze their prey, then drag their victims home ALIVE, leaving them for their larva to feed upon. Suddenly a simple sting seems quite tolerable.","FtrInsectHachi","https://acnhcdn.com/latest/FtrIcon/FtrInsectHachiCropped.png",64,"Pet","Ins12","https://acnhcdn.com/latest/MenuIcon/Ins12.png","I25",NA,NA,"wasp","All day","All day","All day","All day","All day","All day","All day","All day","All day","All day","All day","All day",2500,"All day","All day","All day","All day","All day","All day","All day","All day","All day","All day","All day","All day",NA,"1x1","0","Yes",0,NA,"Any weather","Shaking trees"
NA,"I caught a wharf roach! This water-loving roach has no pier!","Beige","Blue","Insect","InsectFunamushi","https://acnhcdn.com/latest/BookInsectIcon/InsectFunamushiCropped.png","The wharf roach is an omnivore, which is merely a polite way of saying it will eat almost anything. This skittering scavenger and its uncouth appetite help keep beaches clean, it's said. But I dare say, their long antenna and bulging eyes turn MY stomach. Unappetizing indeed...","FtrInsectFunamushi","https://acnhcdn.com/latest/FtrIcon/FtrInsectFunamushiCropped.png",64,"Pet","Ins71","https://acnhcdn.com/latest/MenuIcon/Ins71.png","I71",NA,NA,"wharf roach","All day","All day","All day","All day","All day","All day","All day","All day","All day","All day","All day","All day",200,"All day","All day","All day","All day","All day","All day","All day","All day","All day","All day","All day","All day",NA,"1x1","20","No",0,NA,"Any weather","On beach rocks"
NA,"I caught a yellow butterfly! Shouldn't all BUTTERflies be yellow?","Yellow","Blue","Insect","InsectMonkicho","https://acnhcdn.com/latest/BookInsectIcon/InsectMonkichoCropped.png","Allow me to enlighten you... The yellow butterfly is named for its yellow wings. Need I say more? If I must, then allow me to note that the female yellow butterfly can lay up to 600 eggs at a time! Bleech! And their creepy crawly caterpillars just love to chomp on clover plants. A recipe for disaster, I say. Just imagine reaching for a four-leaf clover, only to touch a larva instead! Yuck! The worst of luck!","FtrInsectMonkicho","https://acnhcdn.com/latest/FtrIcon/FtrInsectMonkichoCropped.png",64,"Pet","Ins1","https://acnhcdn.com/latest/MenuIcon/Ins1.png","I2",NA,NA,"yellow butterfly","4 AM – 7 PM",NA,NA,NA,NA,NA,"4 AM – 7 PM","4 AM – 7 PM","4 AM – 7 PM",NA,"4 AM – 7 PM","4 AM – 7 PM",160,"4 AM – 7 PM",NA,"4 AM – 7 PM",NA,NA,NA,NA,"4 AM – 7 PM",NA,"4 AM – 7 PM","4 AM – 7 PM","4 AM – 7 PM",NA,"1x1","60","No",0,NA,"Any except rain","Flying"
NA,"I got an abalone! Why do I want a sandwich now?","None","None","Sea Creature","DiveFishAwabi","https://acnhcdn.com/latest/BookDiveFishIcon/DiveFishAwabiCropped.png","My feathers, but the abalone is a most deceptive sea snail, wot wot! After seeing its dull brown shell from the outside, one would think it quite plain.But take a gander inside, and you'll see that the abalone's home is a shimmering beauty to behold! The inner layer of the shell is made of ""nacre,"" or ""mother-of-pearl,"" and, hoo, what a dazzling iridescent hue! Let this be a lesson! You mustn't judge a sea snail by the outside of its shell. Judge it by the inside of its shell instead.","FtrDiveFishAwabi","https://acnhcdn.com/latest/FtrIcon/FtrDiveFishAwabi.png",0,"Pet","Awabi","https://acnhcdn.com/latest/MenuIcon/Awabi.png","C17","Fluorescent","Medium","abalone",NA,"4 PM – 9 AM","4 PM – 9 AM",NA,"4 PM – 9 AM","4 PM – 9 AM","4 PM – 9 AM",NA,NA,"4 PM – 9 AM","4 PM – 9 AM","4 PM – 9 AM",2000,"4 PM – 9 AM",NA,"4 PM – 9 AM","4 PM – 9 AM","4 PM – 9 AM","4 PM – 9 AM","4 PM – 9 AM","4 PM – 9 AM","4 PM – 9 AM",NA,NA,NA,"Medium","1x1","1–6","Yes",20,NA,"Any weather","Sea"
NA,"I got an acorn barnacle! Will it grow into an oak barnacle?","None","None","Sea Creature","DiveFishFujitsubo","https://acnhcdn.com/latest/BookDiveFishIcon/DiveFishFujitsuboCropped.png","Do not mistake the acorn barnacle for a relative of the calm. Tut-tut, mollusks they are not. Barnacles are cousins to crabs and lobsters, you see. Though the family resemblance is hard to spot. Acorn barnacles may also seem to live a stationary life, what with being attached to rocks and such. But truth be told, baby barnacles are avid travelers, drifting shell-less about the sea before settling down. Once they find a good rock to affix themselves to, they float free no more. Which begs the question... Do adult acorn barnacles ever look out across the open sea...and long for youthful adventure once more?","FtrDiveFishFujitsubo","https://acnhcdn.com/latest/FtrIcon/FtrDiveFishFujitsubo.png",0,"Pet","Fujitsubo","https://acnhcdn.com/latest/MenuIcon/Fujitsubo.png","C28","Fluorescent","Stationary","acorn barnacle","All day","All day","All day","All day","All day","All day","All day","All day","All day","All day","All day","All day",600,"All day","All day","All day","All day","All day","All day","All day","All day","All day","All day","All day","All day","X-Small","1x1","6–11","Yes",0,NA,"Any weather","Sea"
NA,"I got a chambered nautilus! Is it on the naughty list?","None","None","Sea Creature","DiveFishOumugai","https://acnhcdn.com/latest/BookDiveFishIcon/DiveFishOumugaiCropped.png","The chambered nautilus is perhaps best known for its gorgeous shell. Not only does this shell's interior shine with a pearly luster, it features a near-perfect natural spiral. But those aren't the chambered nautilus's only bragging rights. This cephalopod can have up to 90 tentacles, it's said! These arms come coated with a sticky substance that helps the nautilus capture its prey...Which is far better than using them for overly long hugs, I say.","FtrDiveFishOumugai","https://acnhcdn.com/latest/FtrIcon/FtrDiveFishOumugai.png",0,"Pet","Oumugai","https://acnhcdn.com/latest/MenuIcon/Oumugai.png","C19","Fluorescent","Medium","chambered nautilus","4 PM – 9 AM",NA,NA,NA,NA,NA,"4 PM – 9 AM","4 PM – 9 AM","4 PM – 9 AM","4 PM – 9 AM","4 PM – 9 AM","4 PM – 9 AM",1800,"4 PM – 9 AM",NA,"4 PM – 9 AM",NA,NA,NA,NA,"4 PM – 9 AM","4 PM – 9 AM","4 PM – 9 AM","4 PM – 9 AM","4 PM – 9 AM","Medium","1x1","3–5","Yes",20,NA,"Any weather","Sea"
NA,"I got a Dungeness crab! Dun dun duuuun...geness.","None","None","Sea Creature","DiveFishDungenessCrab","https://acnhcdn.com/latest/BookDiveFishIcon/DiveFishDungenessCrabCropped.png","The Dungeness crab wears a pretty fan-shaped shell that's often done up in purple hues. But eye-catching colors aside, this fellow can be surprisingly hard to spot! That's because the Dungeness crab is something of an expert hider. When scared, it plays a nifty trick! That is, it buries itself beneath the sand with impressive speed. ""Now you see me, now you don't,"" it says as it vanishes before your very eyes!","FtrDiveFishDungenessCrab","https://acnhcdn.com/latest/FtrIcon/FtrDiveFishDungenessCrab.png",0,"Pet","DungenessCrab","https://acnhcdn.com/latest/MenuIcon/DungenessCrab.png","C25","Fluorescent","Medium","Dungeness crab","All day",NA,"All day","All day","All day",NA,NA,"All day","All day","All day",NA,NA,1900,NA,"All day",NA,NA,NA,"All day","All day",NA,"All day","All day","All day","All day","Medium","1x1","3–5","Yes",20,NA,"Any weather","Sea"
NA,"I got a firefly squid! More like a glowswim squid.","None","None","Sea Creature","DiveFishHotaruika","https://acnhcdn.com/latest/BookDiveFishIcon/DiveFishHotaruikaCropped.png","The firefly squid is a wee migratory squid that barely reaches three inches in length. And though they usually live in deep water, they do venture to the coast to spawn. Like their firefly namesakes, these sparkling squid emit a blue bioluminescent glow. This glow may be used to threaten enemies, communicate with friends, or, perhaps, to lure food in. Truth be told, we do not know for sure why the firefly squid glows. We remain in the dark, as they say.","FtrDiveFishHotaruika","https://acnhcdn.com/latest/FtrIcon/FtrDiveFishHotaruika.png",0,"Pet","Hotaruika","https://acnhcdn.com/latest/MenuIcon/Hotaruika.png","C23","Fluorescent","Slow","firefly squid","9 PM – 4 AM",NA,NA,NA,NA,NA,"9 PM – 4 AM","9 PM – 4 AM","9 PM – 4 AM",NA,NA,NA,1400,NA,NA,"9 PM – 4 AM",NA,NA,NA,NA,NA,NA,"9 PM – 4 AM","9 PM – 4 AM","9 PM – 4 AM","X-Small","1x1","6","Yes",0,NA,"Any weather","Sea"
NA,"I got a flatworm! Guess it forgot its spareworm.","None","None","Sea Creature","DiveFishHiramushi","https://acnhcdn.com/latest/BookDiveFishIcon/DiveFishHiramushiCropped.png","Flatworms are flat creatures, and while some types look like sea slugs, they have little else in common. Some types are venomous and produce a poison similar to the kind blowfish are famous for. Flatworms are hermaphrodites and mate by fighting to determine the loser, who then bears the eggs.","FtrDiveFishHiramushi","https://acnhcdn.com/latest/FtrIcon/FtrDiveFishHiramushi.png",0,"Pet","Hiramushi","https://acnhcdn.com/latest/MenuIcon/Hiramushi.png","C39","Fluorescent","Very slow","flatworm",NA,"4 PM – 9 AM",NA,NA,NA,NA,NA,NA,NA,NA,NA,"4 PM – 9 AM",700,NA,NA,NA,"4 PM – 9 AM",NA,NA,NA,"4 PM – 9 AM",NA,NA,NA,NA,"X-Small","1x1","5–8","No",0,NA,"Any weather","Sea"
NA,"I got a gazami crab! What a gripping find!","None","None","Sea Creature","DiveFishGazami","https://acnhcdn.com/latest/BookDiveFishIcon/DiveFishGazamiCropped.png","The gazami crab may be better known by its more descriptive name… the Japanese blue crab. It gets its name from the blue tint sometimes found in its shell and legs. Its paddle-like rear legs are what help it to swim freely and quickly through the water. Of course, this gazami crab couldn't swim enough to get away from you!","FtrDiveFishGazami","https://acnhcdn.com/latest/FtrIcon/FtrDiveFishGazami.png",0,"Pet","Gazami","https://acnhcdn.com/latest/MenuIcon/Gazami.png","C24","Fluorescent","Medium","gazami crab",NA,"All day",NA,NA,NA,"All day","All day",NA,NA,"All day","All day","All day",2200,"All day",NA,"All day","All day","All day",NA,NA,"All day","All day",NA,NA,NA,"Medium","1x1","2–5","Yes",20,NA,"Any weather","Sea"
NA,"GAAAAH! I got a giant isopod! It's the crustodian of the sea.","None","None","Sea Creature","DiveFishDaiougusokumushi","https://acnhcdn.com/latest/BookDiveFishIcon/DiveFishDaiougusokumushiCropped.png","Growing up to nearly 20 inches, the sea-dwelling giant isopod is the world's largest cousin of the pill bug. Twenty inches?! Twenty times as revolting, I say! Making matters worse for those of us who find the pill bug repulsive rather than ""cute""... The giant isopod can swim shockingly fast and is known for its voracious appetite. In fact, it's most happy when dining on the carcasses of animals that have sunk to the bottom of the sea! This behavior has earned it a nickname... 'the vacuum cleaner of the deep.' Why must nature play such awful pranks on me?","FtrDiveFishDaiougusokumushi","https://acnhcdn.com/latest/FtrIcon/FtrDiveFishDaiougusokumushi.png",0,"Pet","Daiougusokumushi","https://acnhcdn.com/latest/MenuIcon/Daiougusokumushi.png","C35","No lighting","Very fast","giant isopod",NA,"9 AM – 4 PM; 9 PM – 4 AM",NA,NA,NA,"9 AM – 4 PM; 9 PM – 4 AM",NA,NA,NA,NA,"9 AM – 4 PM; 9 PM – 4 AM","9 AM – 4 PM; 9 PM – 4 AM",12000,"9 AM – 4 PM; 9 PM – 4 AM",NA,NA,"9 AM – 4 PM; 9 PM – 4 AM","9 AM – 4 PM; 9 PM – 4 AM",NA,NA,"9 AM – 4 PM; 9 PM – 4 AM",NA,NA,NA,NA,"Medium","1x1","1","No",80,NA,"Any weather","Sea"
NA,"I got a gigas giant clam! It's kind of a big deal.","None","None","Sea Creature","DiveFishShakogai","https://acnhcdn.com/latest/BookDiveFishIcon/DiveFishShakogaiCropped.png","Gigas giant clams live in warm-water coral reefs and are the biggest bivalves in the world. Growing as wide as six feet and weighing up to 600 pounds, these clams can live to be 100 years old. And yes, these mighty creatures look as though they could eat a swimmer whole. But they eat plankton instead and get valuable nutrients from an algae they live in symbiosis with. Indeed, these enormous gents get all the sustenance they need by lying face up with their shells half-open. If such was my life, I'd be happy as a clam too.","FtrDiveFishShakogai","https://acnhcdn.com/latest/FtrIcon/FtrDiveFishShakogai.png",0,"Pet","Shakogai","https://acnhcdn.com/latest/MenuIcon/Shakogai.png","C18","Fluorescent","Very fast","gigas giant clam",NA,"All day",NA,NA,NA,"All day","All day",NA,"All day",NA,NA,"All day",15000,NA,NA,"All day","All day","All day",NA,NA,"All day",NA,"All day",NA,NA,"X-Large","2x1","1","Yes",80,NA,"Any weather","Sea"
NA,"I got a horseshoe crab! I hope it's lucky!","None","None","Sea Creature","DiveFishKabutogani","https://acnhcdn.com/latest/BookDiveFishIcon/DiveFishKabutoganiCropped.png","Some might say it's good luck to catch a horseshoe crab. But I am NOT among them, eh wot! Though called a ""crab,"" this beast is an arthropod and thus more akin to spiders and scorpions! Its long tail resembles a scorpion stinger, in fact! Though it's quite harmless, they say. A ""living fossil,"" the horseshoe crab has been around since before the dinosaurs. With that tank-like shell, I suppose it WOULD be the one to survive. But here's what truly rattles me to my beak... During breeding season, horseshoe crabs crawl up on the beach and make nests together in the hundreds. HUNDREDS OF HORSESHOE CRABS! And with that I can say no more.","FtrDiveFishKabutogani","https://acnhcdn.com/latest/FtrIcon/FtrDiveFishKabutogani.png",0,"Pet","Kabutogani","https://acnhcdn.com/latest/MenuIcon/Kabutogani.png","C36","No lighting","Medium","horseshoe crab",NA,"9 PM – 4 AM",NA,NA,NA,"9 PM – 4 AM",NA,NA,NA,NA,NA,"9 PM – 4 AM",2500,NA,NA,NA,"9 PM – 4 AM","9 PM – 4 AM",NA,NA,"9 PM – 4 AM",NA,NA,NA,NA,"Medium","1x1","3–5","No",20,NA,"Any weather","Sea"
NA,"I got a lobster! Lobjective complete.","None","None","Sea Creature","DiveFishLobster","https://acnhcdn.com/latest/BookDiveFishIcon/DiveFishLobsterCropped.png","The lobster is rather famous for its two large claws. But did you know that, in fact, it has six claws total? Of course, the four tiny claws aren't as threatening as its large ""crusher claw"" is. That pincer can put a hundred pounds of pressure on in a pinch! Just a little something to bear in mind when a lobster tries to shake your hand.","FtrDiveFishLobster","https://acnhcdn.com/latest/FtrIcon/FtrDiveFishLobster.png",0,"Pet","Fish54","https://acnhcdn.com/latest/MenuIcon/Fish54.png","C34","Fluorescent","Fast","lobster","All day",NA,"All day",NA,"All day",NA,"All day",NA,"All day",NA,NA,NA,4500,NA,NA,"All day",NA,NA,"All day","All day",NA,NA,"All day","All day",NA,"Large","1x1","1–2","Yes",40,NA,"Any weather","Sea"
NA,"I got a mantis shrimp! Shrimply amazing!","None","None","Sea Creature","DiveFishSyako","https://acnhcdn.com/latest/BookDiveFishIcon/DiveFishSyakoCropped.png","Think carefully before you mock the mantis shrimp for its diminutive size. I warn you, it's itching for a fight! A pugilist through and through, this brightly hued fellow packs a punch unparalleled on land or sea. Not only are its forelimbs shaped like clubs and scythes, its arms are naturally spring-loaded too! Thus the mantis shrimp's high-speed blows crack open crabs and oyster shells with ease. And should you grab it with your hands, you might discover why it's called ""the thumb splitter"" too!","FtrDiveFishShako","https://acnhcdn.com/latest/FtrIcon/FtrDiveFishShako.png",0,"Pet","Shako","https://acnhcdn.com/latest/MenuIcon/Shako.png","C32","Fluorescent","Medium","mantis shrimp","4 PM – 9 AM","4 PM – 9 AM","4 PM – 9 AM","4 PM – 9 AM","4 PM – 9 AM","4 PM – 9 AM","4 PM – 9 AM","4 PM – 9 AM","4 PM – 9 AM","4 PM – 9 AM","4 PM – 9 AM","4 PM – 9 AM",2500,"4 PM – 9 AM","4 PM – 9 AM","4 PM – 9 AM","4 PM – 9 AM","4 PM – 9 AM","4 PM – 9 AM","4 PM – 9 AM","4 PM – 9 AM","4 PM – 9 AM","4 PM – 9 AM","4 PM – 9 AM","4 PM – 9 AM","Small","1x1","2–8","Yes",20,NA,"Any weather","Sea"
NA,"I got a moon jellyfish! Now to find a sun peanutbutterfish.","None","None","Sea Creature","DiveFishMizukurage","https://acnhcdn.com/latest/BookDiveFishIcon/DiveFishMizukurageCropped.png","Ah, the moon jellyfish...what's not to love about this pretty floating flower of the sea... Well, I suppose its tentacles do give a sting when touched...but it's only a mild thing to the likes of us. Other creatures may not be so fond of this translucent beauty. Though who can blame them, really? Moon jellyfish have stinging cells called cnidocytes that kill fish and other small critters that float by. And they use their ""oral arms"" to pull these morsels into their mouths and stomachs. Indeed, one need but observe the moon jellyfish to see how brutal AND beautiful nature can be.","FtrDiveFishMizukurage","https://acnhcdn.com/latest/FtrIcon/FtrDiveFishMizukurage.png",0,"Pet","Mizukurage","https://acnhcdn.com/latest/MenuIcon/Mizukurage.png","C9","Fluorescent","Very slow","moon jellyfish",NA,"All day",NA,NA,NA,"All day",NA,NA,NA,NA,NA,"All day",600,NA,NA,NA,"All day","All day",NA,NA,"All day",NA,NA,NA,NA,"Small","1x1","4–12","Yes",0,NA,"Any weather","Sea"
NA,"I got a mussel! It's been working out","None","None","Sea Creature","DiveFishMuhrugai","https://acnhcdn.com/latest/BookDiveFishIcon/DiveFishMuhrugaiCropped.png","Did you know the mussel has a beard?! Hoo! It's true! Well, partially true, anyway. Mussels have a special gland that secretes a thing called ""bysuss"" or ""byssal thread."" They use these tough beard-like fibers to anchor themselves to rocks and keep themselves in place. So, you see, the mussel's beard is functional rather than merely stylish. Then again, perhaps all beards should be this way.","FtrDiveFishMuhrugai","https://acnhcdn.com/latest/FtrIcon/FtrDiveFishMuhrugai.png",0,"Pet","Muhrugai","https://acnhcdn.com/latest/MenuIcon/Muhrugai.png","C12","No lighting","Slow","mussel",NA,"All day","All day",NA,NA,"All day","All day",NA,NA,"All day","All day","All day",1500,"All day",NA,"All day","All day","All day",NA,"All day","All day","All day",NA,NA,NA,"Small","1x1","3–8","No",0,NA,"Any weather","Sea"
